title	year	discipline_names	url
COMPLEX REVISITED: REMARKS ON SOME BASIC ISSUES IN COMPUTATIONAL LEXICOGRAPHY/LEXICOLOGY	1992	['Linguistics']	www.jstor.org/stable/10.2307/44308295
COMPUTATIONAL LEXICOGRAPHY: A QUERY SYSTEM FOR TEXT CORPORA	1992	['Linguistics']	www.jstor.org/stable/10.2307/44308296
TOOLS FOR COMPUTER-AIDED CORPUS LEXICOGRAPHY: THE HECTOR PROJECT	1992	['Linguistics']	www.jstor.org/stable/10.2307/44308286
TOWARDS A COMPUTERIZED HISTORICAL DICTIONARY OF DUTCH	1992	['Linguistics']	www.jstor.org/stable/10.2307/44308292
USING A BILINGUAL COMPUTERIZED DICTIONARY TO RETRIEVE SUPPORT VERBS AND COMBINATORIAL INFORMATION	1992	['Linguistics']	www.jstor.org/stable/10.2307/44308289
A Mixed-Methods Study of Teachers of the Deaf Learning to Integrate Computers Into Their Teaching	2005	['Education', 'Linguistics']	www.jstor.org/stable/10.2307/26234740
Combining Cognitive Learning Theory and Computer Assisted Instruction for Deaf Learners	1992	['Education', 'Linguistics']	www.jstor.org/stable/10.2307/44400994
Computer-Mediated Communication and the Gallaudet University Community	2008	['Education', 'Linguistics']	www.jstor.org/stable/10.2307/26234491
Deaf Persons and Computer Use	2004	['Education', 'Linguistics']	www.jstor.org/stable/10.2307/26234628
ENFI — An Approach to Teaching Writing Through Computers	1996	['Education', 'Linguistics']	www.jstor.org/stable/10.2307/44392466
Integration of Computers and Related Technologies into Deaf Education Teacher Preparation Programs	2001	['Education', 'Linguistics']	www.jstor.org/stable/10.2307/44393454
Productive Administratíve Applications of Computers in Schools and Programs for Deaf Students	1994	['Education', 'Linguistics']	www.jstor.org/stable/10.2307/44390331
A Study in Computer-Assisted Lexicology: Evidence on the Emergence of Hopefully as a Sentence Adverb from the JSTOR Journal Archive and Other Electronic Resources	1998	['Language & Literature', 'Linguistics']	www.jstor.org/stable/10.2307/455826
Computer-Grown Trees	1992	['Language & Literature', 'Linguistics']	www.jstor.org/stable/10.2307/455460
Earlier Computer-Assisted Evidence on the Emergence of Hopefully as a Sentence Adverb	1999	['Language & Literature', 'Linguistics']	www.jstor.org/stable/10.2307/455670
Using Computers in Dialect Research	1992	['Language & Literature', 'Linguistics']	www.jstor.org/stable/10.2307/455570
Book Review : Cyborg Mind. What Brain-Computer and Mind-Cyberspace Interfaces Mean for Cyberneuroethics	2022	['Anthropology', 'Linguistics']	www.jstor.org/stable/10.2307/27297505
The Computer Programmer	2004	['Language & Literature', 'Linguistics', 'Education']	www.jstor.org/stable/10.2307/25745837
"""That's Us! A Book About Ourselves"" An EFL Project with Intermediate Learners, Incorporating the Computer as a Tool"	1993	['Technology', 'Linguistics', 'Computer Science']	www.jstor.org/stable/10.2307/24147670
A COMPUTER — BASED LEARNING OF BASIC JAPANESE	1990	['Technology', 'Linguistics', 'Computer Science']	www.jstor.org/stable/10.2307/24147832
A Computerized Phonetics Instructor: BABEL	1990	['Technology', 'Linguistics', 'Computer Science']	www.jstor.org/stable/10.2307/45119323
A Theoretical Foundation for the Development of Pedagogical Tasks in Computer Mediated Communication	1996	['Technology', 'Linguistics', 'Computer Science']	www.jstor.org/stable/10.2307/24157092
Answer Markup on Computer-Assisted Language Learning	1993	['Technology', 'Linguistics', 'Computer Science']	www.jstor.org/stable/10.2307/24147787
Book Review : Computer Modules for Assessing Socio-Cultural Competence	2004	['Technology', 'Linguistics', 'Computer Science']	www.jstor.org/stable/10.2307/24149802
Book Review : Computer Modules for Assessing Socio-Cultural Competence: Russian	2007	['Technology', 'Linguistics', 'Computer Science']	www.jstor.org/stable/10.2307/24147998
Book Review : Language–Learner Computer Interactions: Theory, Methodology, and CALL Applications	2018	['Technology', 'Linguistics', 'Computer Science']	www.jstor.org/stable/10.2307/90021920
Book Review : Live Action English Interactive-TPR on a Computer	2006	['Technology', 'Linguistics', 'Computer Science']	www.jstor.org/stable/10.2307/24156304
Book Review : Multilingual Computer Assisted Language Learning	2021	['Technology', 'Linguistics', 'Computer Science']	www.jstor.org/stable/10.2307/27113718
Book Review : Recent Tools for Computer- and Mobile-Assisted Foreign Language Learning	2021	['Technology', 'Linguistics', 'Computer Science']	www.jstor.org/stable/10.2307/27113737
Book Review : Spanish Partner Introductory Spanish Exercises for Personal Computers	1998	['Technology', 'Linguistics', 'Computer Science']	www.jstor.org/stable/10.2307/24147826
Book Review : TACT (THEMATIC ANALYSIS OF COMPUTER TEXTS) VERSION 1.2	1990	['Technology', 'Linguistics', 'Computer Science']	www.jstor.org/stable/10.2307/24180482
CATACROC: Computer-Assisted Learning of Catalan	1993	['Technology', 'Linguistics', 'Computer Science']	www.jstor.org/stable/10.2307/24147777
COMPUTER PROGRAMS DEVELOPED BY INDEPENDENT CONTRACTORS: WHO OWNS THE COPYRIGHT?	1990	['Technology', 'Linguistics', 'Computer Science']	www.jstor.org/stable/10.2307/24180476
CUSTOMIZING A COMPUTERIZED TEXT ANALYZER FOR ESL WRITERS: COST VERSUS GAIN	1990	['Technology', 'Linguistics', 'Computer Science']	www.jstor.org/stable/10.2307/24147836
Computer Adaptive Language Tests (CALT) Offer a Great Potential for Functional Testing. Yet, Why Don't They?	1994	['Technology', 'Linguistics', 'Computer Science']	www.jstor.org/stable/10.2307/24152755
Computer Aided Analysis of Foreign Language Writing Process	1994	['Technology', 'Linguistics', 'Computer Science']	www.jstor.org/stable/10.2307/24152742
Computer Applications and Research Agendas: Another Dimension in Professional Advancement	1999	['Technology', 'Linguistics', 'Computer Science']	www.jstor.org/stable/10.2307/24147757
Computer Assistance for Reading and Writing Japanese as a Foreign Language	2002	['Technology', 'Linguistics', 'Computer Science']	www.jstor.org/stable/10.2307/24149462
Computer Assisted Language Learning: A Client's View	1990	['Technology', 'Linguistics', 'Computer Science']	www.jstor.org/stable/10.2307/45119300
Computer Assisted Learning: Teacher Training Methodology and Evaluation of a Seminar for Language Teachers	1997	['Technology', 'Linguistics', 'Computer Science']	www.jstor.org/stable/10.2307/45119226
Computer vs. Workbook Instruction in Second Language Acquisition	1996	['Technology', 'Linguistics', 'Computer Science']	www.jstor.org/stable/10.2307/24157094
Computer-Assisted Error Analysis and Courseware Design: Applications for ESL in the Swedish Context	1991	['Technology', 'Linguistics', 'Computer Science']	www.jstor.org/stable/10.2307/45119589
Computer-Assisted Language Learning (CALL) in Extracurricular/Extramural Contexts	2017	['Technology', 'Linguistics', 'Computer Science']	www.jstor.org/stable/10.2307/90014674
Computer-Mediated Feedback in Composition Correction	2001	['Technology', 'Linguistics', 'Computer Science']	www.jstor.org/stable/10.2307/24147952
Computer-mediated Communication: Texts and Strategies	2004	['Technology', 'Linguistics', 'Computer Science']	www.jstor.org/stable/10.2307/24149395
Computer-mediated Materials for Chinese Character Learning	2002	['Technology', 'Linguistics', 'Computer Science']	www.jstor.org/stable/10.2307/24149460
Computerized Dictation for Assessing Listening Proficiency	1995	['Technology', 'Linguistics', 'Computer Science']	www.jstor.org/stable/10.2307/24147899
Contextualized Computer-based L2 Prosody Training: Evaluating the Effects of Discourse Context and Video Input	2005	['Technology', 'Linguistics', 'Computer Science']	www.jstor.org/stable/10.2307/24147974
Corpora Processing and Computational Scaffolding for a Web-based English Learning Environment: The CANDLE Project	2006	['Technology', 'Linguistics', 'Computer Science']	www.jstor.org/stable/10.2307/24156295
Developing a Multimedia, Computer-based Spanish Placement Test	2007	['Technology', 'Linguistics', 'Computer Science']	www.jstor.org/stable/10.2307/24147985
English Language Learners’ Strategies for Reading Computer-Based Texts at Home and in School	2016	['Technology', 'Linguistics', 'Computer Science']	www.jstor.org/stable/10.2307/90014366
Error Analysis in Japanese Writing and Its Implementation in a Computer Assisted Language Learning System on the World Wide Web	1998	['Technology', 'Linguistics', 'Computer Science']	www.jstor.org/stable/10.2307/24147683
Exploiting the Potential of a Computer-Based Grammar Checker in Conjunction with Self-Monitoring Strategies with Advanced Level Students of French	2001	['Technology', 'Linguistics', 'Computer Science']	www.jstor.org/stable/10.2307/24148035
Face-to-face and Computer-mediated Peer Review in EFL Writing	2007	['Technology', 'Linguistics', 'Computer Science']	www.jstor.org/stable/10.2307/24147912
Fifty Years of Classical Computing: A Progress Report	2001	['Technology', 'Linguistics', 'Computer Science']	www.jstor.org/stable/10.2307/24147050
Foreign Language Productivity in Synchronous Versus Asynchronous Computer-mediated Communication	2003	['Technology', 'Linguistics', 'Computer Science']	www.jstor.org/stable/10.2307/24149482
Human Factors in a Computer Assisted Foreign Language Environment: The Effects of Gender, Personality and Keyboard Control	1995	['Technology', 'Linguistics', 'Computer Science']	www.jstor.org/stable/10.2307/24147898
HyperCharacters: A Pilot Study in Computerized Learning of Chinese Characters	1996	['Technology', 'Linguistics', 'Computer Science']	www.jstor.org/stable/10.2307/24157095
Improved Delivery of Lexical Information in a Computer Assisted Reading Instruction Program	1994	['Technology', 'Linguistics', 'Computer Science']	www.jstor.org/stable/10.2307/24152767
Interactional Features of Synchronous Computer-Mediated Communication in the Intermediate L2 Class: A Sociocultural Case Study	2002	['Technology', 'Linguistics', 'Computer Science']	www.jstor.org/stable/10.2307/24149361
Interdisciplinary: Computer Assisted Linguistic Research and the Development of LSP Courseware	1993	['Technology', 'Linguistics', 'Computer Science']	www.jstor.org/stable/10.2307/24147667
Interpreting Visual Feedback on Suprasegmentals in Computer Assisted Pronunciation Instruction	1994	['Technology', 'Linguistics', 'Computer Science']	www.jstor.org/stable/10.2307/24152754
Is Computer-Based Grammar Instruction as Effective as Teacher-Directed Grammar Instruction for Teaching L2 Structures?	1998	['Technology', 'Linguistics', 'Computer Science']	www.jstor.org/stable/10.2307/24147822
Language and Computing at Duke University: or, Virtue Triumphant, for the Time Being	1995	['Technology', 'Linguistics', 'Computer Science']	www.jstor.org/stable/10.2307/24147588
Mirror, Mirror, on the Wall: Reflections on ComputerAssisted Language Learning	1998	['Technology', 'Linguistics', 'Computer Science']	www.jstor.org/stable/10.2307/24147818
Monitoring Student Behavior in Computerized Latin Exercises	2001	['Technology', 'Linguistics', 'Computer Science']	www.jstor.org/stable/10.2307/24147058
Personality Types and Megabytes: Student Attitudes Toward Computer Mediated Communication (CMC) in the Language Classroom	1995	['Technology', 'Linguistics', 'Computer Science']	www.jstor.org/stable/10.2307/24147897
Practical Design and Implementation Considerations of a Computer Adaptive Foreign Language Test: The Monash/Melbourne French CAT	1995	['Technology', 'Linguistics', 'Computer Science']	www.jstor.org/stable/10.2307/24147742
Putting Computers in Their Place: Presented at CALICO '90 Symposium in Baltimore	1990	['Technology', 'Linguistics', 'Computer Science']	www.jstor.org/stable/10.2307/45119298
Reach Out and Compute Someone	1992	['Technology', 'Linguistics', 'Computer Science']	www.jstor.org/stable/10.2307/24147717
Situated Learning for Foreign Language Teachers in One-to-One Computing Initiatives	2017	['Technology', 'Linguistics', 'Computer Science']	www.jstor.org/stable/10.2307/90014687
Software Engineering Principles Applied to Computer Assisted Language Learning	1997	['Technology', 'Linguistics', 'Computer Science']	www.jstor.org/stable/10.2307/45119224
"Special issue of the ""CALICO Journal"": Computer-mediated Communication and Foreign Language Learning: Context, Research, and Practice May 2005"	2005	['Technology', 'Linguistics', 'Computer Science']	www.jstor.org/stable/10.2307/24147972
Sunoikisis: Computer-Mediated Communication in the Creation of a Virtual Department	2001	['Technology', 'Linguistics', 'Computer Science']	www.jstor.org/stable/10.2307/24147051
THE ANXIETY OVER TECHNOLOGY (AND WHY I LIKE COMPUTERS ANYWAY)	1990	['Technology', 'Linguistics', 'Computer Science']	www.jstor.org/stable/10.2307/24147834
THE COMPUTER LESSON AS AN INTEGRATED ELEMENT IN THE ACADEMIC EFL READING CURRICULUM	1991	['Technology', 'Linguistics', 'Computer Science']	www.jstor.org/stable/10.2307/24156287
Teaching the Computer Swedish: Morphology and Phonology	1990	['Technology', 'Linguistics', 'Computer Science']	www.jstor.org/stable/10.2307/45119299
Test Takers' Experiences with Computer-administered Listening Comprehension Tests: Interviewing for Qualitative Explorations of Test Validity	2004	['Technology', 'Linguistics', 'Computer Science']	www.jstor.org/stable/10.2307/24149400
Testing Computer Assisted Language Testing: Towards a Checklist for CALT	1994	['Technology', 'Linguistics', 'Computer Science']	www.jstor.org/stable/10.2307/24152768
Testing Oral Language Skills via the Computer	2000	['Technology', 'Linguistics', 'Computer Science']	www.jstor.org/stable/10.2307/24147691
The Computerized Mini-AMTB	2004	['Technology', 'Linguistics', 'Computer Science']	www.jstor.org/stable/10.2307/24149393
The Development of Grammatical Competence through Synchronous Computer-mediated Communication	2005	['Technology', 'Linguistics', 'Computer Science']	www.jstor.org/stable/10.2307/24147938
The Effectiveness of Computer-Assisted Pronunciation Training	1992	['Technology', 'Linguistics', 'Computer Science']	www.jstor.org/stable/10.2307/24147626
The Effects of Three Feedback Forms on Learning Through a Computer-Based Tutorial	1992	['Technology', 'Linguistics', 'Computer Science']	www.jstor.org/stable/10.2307/24147885
The Ghost in the Machine: Generating Error Messages In Computer Assisted Language Learning Programs	1995	['Technology', 'Linguistics', 'Computer Science']	www.jstor.org/stable/10.2307/24147900
The Negotiation Model in Asynchronous Computer-mediated Communication (CMC): Negotiation in Task-based Email Exchanges	2006	['Technology', 'Linguistics', 'Computer Science']	www.jstor.org/stable/10.2307/24156250
The Role of Computer-Supported Discussion for Language Teacher Education: What Do the Students Say?	2002	['Technology', 'Linguistics', 'Computer Science']	www.jstor.org/stable/10.2307/24149609
The effectiveness of computer-based spaced repetition in foreign language vocabulary instruction	2016	['Technology', 'Linguistics', 'Computer Science']	www.jstor.org/stable/10.2307/90014364
Thirty years of Computer Assisted Language Instruction: Introduction	1995	['Technology', 'Linguistics', 'Computer Science']	www.jstor.org/stable/10.2307/24147584
Toward Transdisciplinarity in Computer-Assisted Language Learning	2019	['Technology', 'Linguistics', 'Computer Science']	www.jstor.org/stable/10.2307/26816874
Toward an Understanding of Incidental Input Enhancement in Computerized L2 Environments	2006	['Technology', 'Linguistics', 'Computer Science']	www.jstor.org/stable/10.2307/24156298
Using Computer-mediated Communication to Establish Social and Supportive Environments in Teacher Education	2005	['Technology', 'Linguistics', 'Computer Science']	www.jstor.org/stable/10.2307/24147937
Using Computerized Bilingual Dictionaries to Help Maximize English Vocabulary Learning at Japanese Colleges	2003	['Technology', 'Linguistics', 'Computer Science']	www.jstor.org/stable/10.2307/24149483
Using a Computer in Foreign Language Pronunciation Training: What Advantages?	1999	['Technology', 'Linguistics', 'Computer Science']	www.jstor.org/stable/10.2307/24147852
Using a Tablet Computer for EFL Positive Self-Review	2018	['Technology', 'Linguistics', 'Computer Science']	www.jstor.org/stable/10.2307/90021918
Using the Microcomputer to Bridge the Language Gap	1993	['Technology', 'Linguistics', 'Computer Science']	www.jstor.org/stable/10.2307/24147791
What One Has to Know About Methodology in Computing	1993	['Technology', 'Linguistics', 'Computer Science']	www.jstor.org/stable/10.2307/24147669
Writing to Mean: Computer-mediated Feedback in Online Tutoring of Multidraft Compositions	2006	['Technology', 'Linguistics', 'Computer Science']	www.jstor.org/stable/10.2307/24156296
"""Minds and Machines"" for Humanities Majors: A Liberal Arts Course in Computers and Cognition"	1991	['Linguistics']	www.jstor.org/stable/10.2307/30204421
A Computer Study of Systematic Sound Symbolism in Classical Japanese Verse	1994	['Linguistics']	www.jstor.org/stable/10.2307/30200327
A Computer-Assisted Investigation of Gender-Related Idiolect in Octavio Paz and Rosario Castellanos	1992	['Linguistics']	www.jstor.org/stable/10.2307/30204450
A Concept Dictionary of English with Computer Programs for Content Analysis	1991	['Linguistics']	www.jstor.org/stable/10.2307/30208130
A Creative Arts Approach to Computer Programming	1991	['Linguistics']	www.jstor.org/stable/10.2307/30204420
A New Computer-Assisted Literary Criticism?	2002	['Linguistics']	www.jstor.org/stable/10.2307/30200526
Actors: Computing Dramatic Characters that Are on Stage Simultaneously	1994	['Linguistics']	www.jstor.org/stable/10.2307/30200330
An Intelligent Computer-Assistant for Stylistic Instruction	1992	['Linguistics']	www.jstor.org/stable/10.2307/30204449
An Interdisciplinary Bibliography for Computers and the Humanities Courses	1991	['Linguistics']	www.jstor.org/stable/10.2307/30204426
Anatomy of a New Medium: Literary and Pedagogic Uses of Advanced Linguistic Computer Structures	1991	['Linguistics']	www.jstor.org/stable/10.2307/30200238
Animating the Language Machine: Computers and Performance	2002	['Linguistics']	www.jstor.org/stable/10.2307/30200531
Assessing the Impact of Computer-Assisted Instruction (CAI) in Undergraduate Latin American Studies Courses	1997	['Linguistics']	www.jstor.org/stable/10.2307/30200442
Beauty and the Beast: New Approaches to Teaching Computing for Humanities Students at the University of Aberdeen	1992	['Linguistics']	www.jstor.org/stable/10.2307/30204612
"Book Review :              A Stylo-Statistical Study of ""Adolphe"" Preceded by Indexes and a Description of Computer Programming for Language Analysis                             Robert F.                Allen"	1990	['Linguistics']	www.jstor.org/stable/10.2307/30200232
Book Review :              Accessing Antiquity: The Computerization of Classical Studies                             Jon                Solomon	1994	['Linguistics']	www.jstor.org/stable/10.2307/30200331
Book Review :              Computational Approaches to Language Acquisition                             Michael R.                Brent	1999	['Linguistics']	www.jstor.org/stable/10.2307/30200508
Book Review :              Computational Linguistics (Computerlinguistik): An International Handbook on Computer Oriented Language Research and Applications (Handbücher zur Sprach- und Kommunikationswissenschaft, Bd. 4)                             István S.                Bátori                                          Winfried                Lenders                                          Wolfgang                Putschke	1991	['Linguistics']	www.jstor.org/stable/10.2307/30200261
Book Review :              Computer Applications to Music: A Bibliography                             Deta                Davis	1990	['Linguistics']	www.jstor.org/stable/10.2307/30204184
Book Review :              Computer-Assisted Language Learning and Testing. Research Issues and Practice                             Patricia                Dunkel	1993	['Linguistics']	www.jstor.org/stable/10.2307/30200285
Book Review :              Computing for Historians. An Introductory Guide                             Evan                Mawdsley                                          Thomas                Munck	1994	['Linguistics']	www.jstor.org/stable/10.2307/30200332
Book Review :              From Writing to Computers                             Julian                Warner	1995	['Linguistics']	www.jstor.org/stable/10.2307/30200370
Book Review :              Fundamentals in Computer Understanding: Speech and Vision (An Advanced Course)                             J-P.                Haton	1990	['Linguistics']	www.jstor.org/stable/10.2307/30200206
Book Review :              History and Computing                             Peter                Denley                                          Deian                Hopkin	1990	['Linguistics']	www.jstor.org/stable/10.2307/30204186
Book Review :              Informationslinguistische Texterschlieβung (Sprache und Computer, vol. 4.)                             Schwarz                Christoph                                          Gregor                Thurmair	1991	['Linguistics']	www.jstor.org/stable/10.2307/30200263
Book Review :              Literary Computing and Literary Criticism: Theoretical and Practical Essays on Theme and Rhetoric                             Rosanne G.                Potter	1991	['Linguistics']	www.jstor.org/stable/10.2307/30204429
Book Review :              MaxSPITBOL: The SNOBOL4 Language for the Apple Macintosh Computer                             Eric                Johnson	1990	['Linguistics']	www.jstor.org/stable/10.2307/30200210
Book Review :              Natural Language Processing in Prolog: An Introduction to Computational Linguistics                             Gerald                Gazdar                                          Chris                Mellish	1990	['Linguistics']	www.jstor.org/stable/10.2307/30204155
Book Review :              Text, ConText, and HyperText: Writing with and for the Computer                             Edward                Barrett	1990	['Linguistics']	www.jstor.org/stable/10.2307/30204185
Book Review :              The Humanities Computing Yearbook - 1988                             Ian                Lancashire                                          Willard                McCarty	1990	['Linguistics']	www.jstor.org/stable/10.2307/30200205
Book Review :              Thirty Years of Computer Assisted Language Instruction. Festschrift for John R. Russell                             Ruth H.                Sanders	1996	['Linguistics']	www.jstor.org/stable/10.2307/30200406
Bringing Bacon Home: The Divergent Progress of Computer-Aided Historical Research in Europe and the United States	1996	['Linguistics']	www.jstor.org/stable/10.2307/30204655
Categorisation Techniques in Computer-Assisted Reading and Analysis of Texts (CARAT) in the Humanities	2003	['Linguistics']	www.jstor.org/stable/10.2307/30204883
Church History and the Computer	1990	['Linguistics']	www.jstor.org/stable/10.2307/30204172
Comparing Text Editions with the Aid of the Computer	1994	['Linguistics']	www.jstor.org/stable/10.2307/30204576
Computational Musicology	1993	['Linguistics']	www.jstor.org/stable/10.2307/30200278
Computer Documentation: Writing about Technology	1995	['Linguistics']	www.jstor.org/stable/10.2307/30204650
Computer Enhanced Assessment of Case-Notes in Studies of Psychopathology: The Example of an Autistic Subject	1994	['Linguistics']	www.jstor.org/stable/10.2307/30200325
Computer Literacy for the Rest of Us	1993	['Linguistics']	www.jstor.org/stable/10.2307/30204572
Computer Modeling and Critical Theory	1996	['Linguistics']	www.jstor.org/stable/10.2307/30200376
Computer-Assisted Techniques to Enhance Transformative Learning in First-Year Literature Courses	1996	['Linguistics']	www.jstor.org/stable/10.2307/30200382
Computer-Based Authorship Attribution without Lexical Measures	2001	['Linguistics']	www.jstor.org/stable/10.2307/30204850
Computer-Mediated Texts and Textuality: Theory and Practice	2002	['Linguistics']	www.jstor.org/stable/10.2307/30200528
Computerizing Biblical Literature	1996	['Linguistics']	www.jstor.org/stable/10.2307/30200377
Computerizing Céline	1993	['Linguistics']	www.jstor.org/stable/10.2307/30204563
Computers and Historians: Past, Present, and Future	1996	['Linguistics']	www.jstor.org/stable/10.2307/30204654
Computers and Legal Reasoning: Developments in Germany	1991	['Linguistics']	www.jstor.org/stable/10.2307/30200258
Computers and Resource-Based History Teaching: A UK Perspective	2000	['Linguistics']	www.jstor.org/stable/10.2307/30204823
Computers and Teaching Literature: Introduction	1996	['Linguistics']	www.jstor.org/stable/10.2307/30200375
Computing Historical Consciousness. A Quantitative Inquiry into the Presence of the Past in Newspaper Texts	2001	['Linguistics']	www.jstor.org/stable/10.2307/30204856
Computing in Musicology, 1966-91	1991	['Linguistics']	www.jstor.org/stable/10.2307/30208121
Critical Theory and Textual Computing: Comments and Suggestions	1993	['Linguistics']	www.jstor.org/stable/10.2307/30204564
Current Approaches to Punctuation in Computational Linguistics	1996	['Linguistics']	www.jstor.org/stable/10.2307/30204669
DOC 1988: The Modernization of a Chinese Dialect Dictionary on Computer	1990	['Linguistics']	www.jstor.org/stable/10.2307/30200226
E-Talk: Attitudes and Motivation in Computer-Assisted Classroom Discussion	1994	['Linguistics']	www.jstor.org/stable/10.2307/30204580
Editor's Introduction: Image-Based Humanities Computing	2002	['Linguistics']	www.jstor.org/stable/10.2307/30204693
Editorial: Computers in Humanities Teaching and Research	2000	['Linguistics']	www.jstor.org/stable/10.2307/30204817
Electrifying the Canon: The Impact of Computing on Classical Studies	2000	['Linguistics']	www.jstor.org/stable/10.2307/30204820
