title	year	discipline_names	url
Computationally, tone is different	2016	['Linguistics']	www.jstor.org/stable/10.2307/26337992
Formal and computational verification of phonological analyses	2017	['Linguistics']	www.jstor.org/stable/10.2307/26847511
Book Review : Rebuilt: How Becoming Part Computer Made Me More Human ChorostMichael	2007	['Linguistics', 'Language & Literature']	www.jstor.org/stable/10.2307/26190653
Computer-Assisted Language Learning in British Sign Language Learning	2011	['Linguistics', 'Language & Literature']	www.jstor.org/stable/10.2307/26190826
Book Review :          AN INTRODUCTION TO COMPUTER-ASSISTED LANGUAGE TEACHING                    M. J.           Kenning                             M.-M.           Kenning	1990	['Linguistics']	www.jstor.org/stable/10.2307/44487525
Book Review :          COMPUTATIONAL APPROACHES TO LANGUAGE ACQUISITION                    Michael R.           Brent	1999	['Linguistics']	www.jstor.org/stable/10.2307/44486929
Book Review :          COMPUTATIONAL PSYCHOLINGUISTICS: AI AND CONNECTIONIST MODELS OF HUMAN LANGUAGE PROCESSING                    Ton           Dijkstra                             Koenraad           de Smedt	1997	['Linguistics']	www.jstor.org/stable/10.2307/44487981
Book Review :          COMPUTER LEARNER CORPORA, SECOND LANGUAGE ACQUISITION, AND FOREIGN LANGUAGE TEACHING                    Sylviane           Granger                             Joseph           Hung                             Stephanie           Petch-Tyson	2005	['Linguistics']	www.jstor.org/stable/10.2307/44486808
Book Review :          COMPUTER-ASSISTED LANGUAGE LEARNING: CONTEXT AND CONCEPTUALIZATION                    Michael           Levy	1999	['Linguistics']	www.jstor.org/stable/10.2307/44486916
Book Review :          COMPUTERS IN APPLIED LINGUISTICS: AN INTERNATIONAL PERSPECTIVE                    Martha C.           Pennington                             Vance           Stevens	1994	['Linguistics']	www.jstor.org/stable/10.2307/44487703
Book Review :          LANGUAGE LEARNING THROUGH SOCIAL COMPUTING: OCCASIONAL PAPERS OF THE APPLIED LINGUISTICS ASSOCIATION OF AUSTRALIA, 16                    Robert           Debski                             June           Gassin                             Mike           Smith	1999	['Linguistics']	www.jstor.org/stable/10.2307/44486928
Book Review :          STUDIES IN COMPUTER-AIDED LEXICOLOGY                    Martin           Gellerstam	1991	['Linguistics']	www.jstor.org/stable/10.2307/44488400
Book Review :          VYGOTSKY AND COGNITIVE SCIENCE: LANGUAGE AND THE UNIFICATION OF SOCIAL AND COMPUTATIONAL MIND                    William           Frawley	2000	['Linguistics']	www.jstor.org/stable/10.2307/44486458
COMPUTER-MEDIATED NEGOTIATED INTERACTION AND LEXICAL ACQUISITION	2004	['Linguistics']	www.jstor.org/stable/10.2307/44486733
LEARNER VERSUS NONLEARNER PATTERNS OF STYLISTIC VARIATION IN SYNCHRONOUS COMPUTER-MEDIATED FRENCH: Yes/No Questions and Nous Versus On	2009	['Linguistics']	www.jstor.org/stable/10.2307/44485865
PRONUNCIATION IN FACE-TO-FACE AND AUDIO-ONLY SYNCHRONOUS COMPUTER-MEDIATED LEARNER INTERACTIONS	2017	['Linguistics']	www.jstor.org/stable/10.2307/26330758
SYNCHRONOUS COMPUTER-MEDIATED COMMUNICATION AND INTERACTION	2016	['Linguistics']	www.jstor.org/stable/10.2307/26330932
SYNTACTIC AND PROSODIC COMPUTATIONS IN THE RESOLUTION OF RELATIVE CLAUSE ATTACHMENT AMBIGUITY BY ENGLISH-FRENCH LEARNERS	2008	['Linguistics']	www.jstor.org/stable/10.2307/44485810
THE EFFECTS OF INDUCED ANXIETY ON THREE STAGES OF COGNITIVE PROCESSING IN COMPUTERIZED VOCABULARY LEARNING	1994	['Linguistics']	www.jstor.org/stable/10.2307/44487692
THE IMPACT OF RECASTS ON THE DEVELOPMENT OF PRIMARY STRESS IN A SYNCHRONOUS COMPUTER-MEDIATED ENVIRONMENT	2017	['Linguistics']	www.jstor.org/stable/10.2307/26330759
The Computer, Hypertext, and Classical Studies	1991	['Classical Studies', 'Language & Literature', 'Linguistics']	www.jstor.org/stable/10.2307/294933
A Writing Project Integrating Cultural Aspects, Computer Technology, and Writing Skills	2004	['Education', 'Asian Studies', 'Language & Literature', 'Linguistics']	www.jstor.org/stable/10.2307/42922865
Computer-room Demonstration at DLI: Teaching Korean Through Interactive Videodisc (IVD)/Computer	1995	['Education', 'Asian Studies', 'Language & Literature', 'Linguistics']	www.jstor.org/stable/10.2307/42922130
Developing Content Materials for Computer-Assisted Study for Enhancing Listening Comprehension Skills in Korean	2000	['Education', 'Asian Studies', 'Language & Literature', 'Linguistics']	www.jstor.org/stable/10.2307/42922256
To Participate or Not in an Intercultural Seminar Via Global Computer-Mediated Communication	2003	['Education', 'Asian Studies', 'Language & Literature', 'Linguistics']	www.jstor.org/stable/10.2307/42922813
LATIN AND OLD IRISH IN THE MUNICH COMPUTUS: A REASSESSMENT AND FURTHER EVIDENCE	2007	['Language & Literature', 'Irish Studies', 'Linguistics']	www.jstor.org/stable/10.2307/20696348
THE EARLY OLD IRISH MATERIAL IN THE NEWLY DISCOVERED COMPUTUS EINSIDLENSIS (C. AD 700)	2008	['Language & Literature', 'Irish Studies', 'Linguistics']	www.jstor.org/stable/10.2307/20696363
